******************** Stress Settings ********************
Command:
  Type: write
  Count: -1
  Duration: 30 SECONDS
  No Warmup: false
  Consistency Level: ONE
  Target Uncertainty: not applicable
  Key Size (bytes): 10
  Counter Increment Distibution: add=fixed(1)
Rate:
  Auto: false
  Thread Count: 50
  OpsPer Sec: 0
Population:
  Sequence: 1..1000000
  Order: ARBITRARY
  Wrap: true
Insert:
  Revisits: Uniform:  min=1,max=1000000
  Visits: Fixed:  key=1
  Row Population Ratio: Ratio: divisor=1.000000;delegate=Fixed:  key=1
  Batch Type: not batching
Columns:
  Max Columns Per Key: 1
  Column Names: [C0]
  Comparator: AsciiType
  Timestamp: null
  Variable Column Count: false
  Slice: false
  Size Distribution: Fixed:  key=34
  Count Distribution: Fixed:  key=1
Errors:
  Ignore: false
  Tries: 10
Log:
  No Summary: false
  No Settings: false
  File: null
  Interval Millis: 1000
  Level: NORMAL
Mode:
  API: JAVA_DRIVER_NATIVE
  Connection Style: CQL_PREPARED
  CQL Version: CQL3
  Protocol Version: V4
  Username: null
  Password: null
  Auth Provide Class: null
  Max Pending Per Connection: 128
  Connections Per Host: 8
  Compression: NONE
Node:
  Nodes: [cassandra_a, cassandra_b, cassandra_c]
  Is White List: false
  Datacenter: null
Schema:
  Keyspace: keyspace1
  Replication Strategy: org.apache.cassandra.locator.SimpleStrategy
  Replication Strategy Pptions: {replication_factor=3}
  Table Compression: null
  Table Compaction Strategy: null
  Table Compaction Strategy Options: {}
Transport:
  factory=org.apache.cassandra.thrift.TFramedTransportFactory; truststore=null; truststore-password=null; keystore=null; keystore-password=null; ssl-protocol=TLS; ssl-alg=SunX509; store-type=JKS; ssl-ciphers=TLS_RSA_WITH_AES_128_CBC_SHA,TLS_RSA_WITH_AES_256_CBC_SHA; 
Port:
  Native Port: 9042
  Thrift Port: 9160
  JMX Port: 7199
Send To Daemon:
  *not set*
Graph:
  File: null
  Revision: unknown
  Title: null
  Operation: WRITE
TokenRange:
  Wrap: false
  Split Factor: 1

Connected to cluster: TestCluster, max pending requests per connection 128, max connections per host 8
Datatacenter: datacenter1; Host: cassandra_c/172.19.0.4; Rack: rack1
Datatacenter: datacenter1; Host: cassandra_b/172.19.0.3; Rack: rack1
Datatacenter: datacenter1; Host: cassandra_a/172.19.0.2; Rack: rack1
Created keyspaces. Sleeping 3s for propagation.
Sleeping 2s...
Warming up WRITE with 150000 iterations...
Failed to connect over JMX; not collecting these stats
Running WRITE with 50 threads 30 seconds
Failed to connect over JMX; not collecting these stats
type       total ops,    op/s,    pk/s,   row/s,    mean,     med,     .95,     .99,    .999,     max,   time,   stderr, errors,  gc: #,  max ms,  sum ms,  sdv ms,      mb
total,           582,     582,     582,     582,    30.4,    50.3,    50.4,    50.5,    50.8,    50.9,    1.0,  0.00000,      0,      0,       0,       0,       0,       0
total,          2055,    1473,    1473,    1473,    34.2,    50.3,    50.4,    50.4,    50.5,    50.8,    2.0,  0.30656,      0,      0,       0,       0,       0,       0
total,          3518,    1463,    1463,    1463,    34.3,    50.3,    50.4,    50.6,    84.3,    84.6,    3.0,  0.20886,      0,      0,       0,       0,       0,       0
total,          5048,    1530,    1530,    1530,    32.9,    50.3,    50.3,    50.4,    50.5,    56.1,    4.0,  0.15744,      0,      0,       0,       0,       0,       0
total,          6463,    1415,    1415,    1415,    34.3,    50.3,    50.3,    50.4,    50.4,    53.5,    5.0,  0.12473,      0,      0,       0,       0,       0,       0
total,          7951,    1488,    1488,    1488,    33.7,    50.2,    50.3,    50.4,    50.4,    50.4,    6.0,  0.10367,      0,      0,       0,       0,       0,       0
total,          9446,    1495,    1495,    1495,    33.4,    50.2,    50.4,    50.4,    50.5,    50.5,    7.0,  0.08873,      0,      0,       0,       0,       0,       0
total,         10921,    1475,    1475,    1475,    34.1,    50.2,    50.3,    50.4,    50.5,    52.4,    8.0,  0.07746,      0,      0,       0,       0,       0,       0
total,         12443,    1522,    1522,    1522,    33.1,    50.2,    50.3,    50.4,    50.5,    53.7,    9.0,  0.06899,      0,      0,       0,       0,       0,       0
total,         13991,    1548,    1548,    1548,    32.5,    50.2,    50.3,    50.4,    50.5,    51.3,   10.0,  0.06231,      0,      0,       0,       0,       0,       0
total,         15464,    1473,    1473,    1473,    34.0,    50.2,    50.3,    50.4,    50.5,    50.5,   11.0,  0.05655,      0,      0,       0,       0,       0,       0
total,         16921,    1457,    1457,    1457,    33.4,    50.2,    50.3,    50.4,    50.4,    50.4,   12.0,  0.05176,      0,      0,       0,       0,       0,       0
total,         18413,    1492,    1492,    1492,    33.4,    50.2,    50.3,    50.4,    50.5,    50.5,   13.0,  0.04775,      0,      0,       0,       0,       0,       0
total,         19902,    1489,    1489,    1489,    33.8,    50.2,    50.3,    50.4,    50.5,    50.5,   14.0,  0.04430,      0,      0,       0,       0,       0,       0
total,         21464,    1562,    1562,    1562,    32.3,    50.2,    50.3,    50.4,    50.4,    50.4,   15.0,  0.04153,      0,      0,       0,       0,       0,       0
total,         22943,    1479,    1479,    1479,    34.1,    50.2,    50.3,    50.4,    50.4,    50.5,   16.0,  0.03891,      0,      0,       0,       0,       0,       0
total,         24445,    1502,    1502,    1502,    33.5,    50.3,    50.3,    50.4,    50.5,    50.6,   17.0,  0.03661,      0,      0,       0,       0,       0,       0
total,         25926,    1481,    1481,    1481,    33.0,    50.3,    50.3,    50.4,    50.5,    50.6,   18.0,  0.03456,      0,      0,       0,       0,       0,       0
total,         27413,    1487,    1487,    1487,    33.4,    50.2,    50.3,    50.4,    50.4,    50.4,   19.0,  0.03272,      0,      0,       0,       0,       0,       0
total,         28945,    1532,    1532,    1532,    32.7,    50.2,    50.3,    50.4,    50.5,    50.5,   20.0,  0.03112,      0,      0,       0,       0,       0,       0
total,         30486,    1541,    1541,    1541,    32.7,    50.2,    50.3,    50.4,    50.4,    50.4,   21.0,  0.02969,      0,      0,       0,       0,       0,       0
total,         31966,    1480,    1480,    1480,    34.0,    50.2,    50.3,    50.4,    50.4,    50.4,   22.0,  0.02833,      0,      0,       0,       0,       0,       0
total,         33531,    1565,    1565,    1565,    32.2,    50.2,    50.3,    50.4,    50.4,    50.4,   23.0,  0.02720,      0,      0,       0,       0,       0,       0
total,         35075,    1544,    1544,    1544,    32.4,    50.2,    50.3,    50.4,    50.4,    50.5,   24.0,  0.02610,      0,      0,       0,       0,       0,       0
total,         36513,    1438,    1438,    1438,    34.0,    50.2,    50.3,    50.4,    50.4,    50.4,   25.0,  0.02509,      0,      0,       0,       0,       0,       0
total,         37966,    1453,    1453,    1453,    34.2,    50.2,    50.3,    50.4,    50.4,    50.4,   26.0,  0.02413,      0,      0,       0,       0,       0,       0
total,         39438,    1472,    1472,    1472,    34.2,    50.2,    50.3,    50.4,    55.1,    55.2,   27.0,  0.02323,      0,      0,       0,       0,       0,       0
total,         40931,    1493,    1493,    1493,    33.7,    50.2,    50.3,    50.4,    50.4,    50.4,   28.0,  0.02240,      0,      0,       0,       0,       0,       0
total,         42436,    1505,    1505,    1505,    33.5,    50.2,    50.3,    50.4,    50.4,    50.5,   29.0,  0.02162,      0,      0,       0,       0,       0,       0
total,         43956,    1520,    1520,    1520,    33.1,    50.2,    50.3,    50.4,    50.4,    50.7,   30.0,  0.02091,      0,      0,       0,       0,       0,       0
total,         44897,    1428,    1428,    1428,    34.8,    50.2,    50.3,    50.4,    50.5,    50.6,   30.7,  0.02024,      0,      0,       0,       0,       0,       0


Results:
Op rate                   :    1,464 op/s  [WRITE: 1,464 op/s]
Partition rate            :    1,464 pk/s  [WRITE: 1,464 pk/s]
Row rate                  :    1,464 row/s [WRITE: 1,464 row/s]
Latency mean              :   33.4 ms [WRITE: 33.4 ms]
Latency median            :   50.2 ms [WRITE: 50.2 ms]
Latency 95th percentile   :   50.3 ms [WRITE: 50.3 ms]
Latency 99th percentile   :   50.4 ms [WRITE: 50.4 ms]
Latency 99.9th percentile :   50.5 ms [WRITE: 50.5 ms]
Latency max               :   84.6 ms [WRITE: 84.6 ms]
Total partitions          :     44,897 [WRITE: 44,897]
Total errors              :          0 [WRITE: 0]
Total GC count            : 0
Total GC memory           : 0.000 KiB
Total GC time             :    0.0 seconds
Avg GC time               :    NaN ms
StdDev GC time            :    0.0 ms
Total operation time      : 00:00:30

END
