******************** Stress Settings ********************
Command:
  Type: write
  Count: -1
  Duration: 30 SECONDS
  No Warmup: false
  Consistency Level: ONE
  Target Uncertainty: not applicable
  Key Size (bytes): 10
  Counter Increment Distibution: add=fixed(1)
Rate:
  Auto: false
  Thread Count: 50
  OpsPer Sec: 0
Population:
  Sequence: 1..1000000
  Order: ARBITRARY
  Wrap: true
Insert:
  Revisits: Uniform:  min=1,max=1000000
  Visits: Fixed:  key=1
  Row Population Ratio: Ratio: divisor=1.000000;delegate=Fixed:  key=1
  Batch Type: not batching
Columns:
  Max Columns Per Key: 1
  Column Names: [C0]
  Comparator: AsciiType
  Timestamp: null
  Variable Column Count: false
  Slice: false
  Size Distribution: Fixed:  key=34
  Count Distribution: Fixed:  key=1
Errors:
  Ignore: false
  Tries: 10
Log:
  No Summary: false
  No Settings: false
  File: null
  Interval Millis: 1000
  Level: NORMAL
Mode:
  API: JAVA_DRIVER_NATIVE
  Connection Style: CQL_PREPARED
  CQL Version: CQL3
  Protocol Version: V4
  Username: null
  Password: null
  Auth Provide Class: null
  Max Pending Per Connection: 128
  Connections Per Host: 8
  Compression: NONE
Node:
  Nodes: [cassandra_a, cassandra_b, cassandra_c]
  Is White List: false
  Datacenter: null
Schema:
  Keyspace: keyspace1
  Replication Strategy: org.apache.cassandra.locator.SimpleStrategy
  Replication Strategy Pptions: {replication_factor=3}
  Table Compression: null
  Table Compaction Strategy: null
  Table Compaction Strategy Options: {}
Transport:
  factory=org.apache.cassandra.thrift.TFramedTransportFactory; truststore=null; truststore-password=null; keystore=null; keystore-password=null; ssl-protocol=TLS; ssl-alg=SunX509; store-type=JKS; ssl-ciphers=TLS_RSA_WITH_AES_128_CBC_SHA,TLS_RSA_WITH_AES_256_CBC_SHA; 
Port:
  Native Port: 9042
  Thrift Port: 9160
  JMX Port: 7199
Send To Daemon:
  *not set*
Graph:
  File: null
  Revision: unknown
  Title: null
  Operation: WRITE
TokenRange:
  Wrap: false
  Split Factor: 1

WARN  17:43:55,964 You listed cassandra_c/172.19.0.4:9042 in your contact points, but it wasn't found in the control host's system.peers at startup
Connected to cluster: TestCluster, max pending requests per connection 128, max connections per host 8
Datatacenter: datacenter1; Host: cassandra_b/172.19.0.3; Rack: rack1
Datatacenter: datacenter1; Host: cassandra_a/172.19.0.2; Rack: rack1
Created keyspaces. Sleeping 3s for propagation.
Sleeping 2s...
Warming up WRITE with 150000 iterations...
Failed to connect over JMX; not collecting these stats
Running WRITE with 50 threads 30 seconds
Failed to connect over JMX; not collecting these stats
type       total ops,    op/s,    pk/s,   row/s,    mean,     med,     .95,     .99,    .999,     max,   time,   stderr, errors,  gc: #,  max ms,  sum ms,  sdv ms,      mb
total,            23,      23,      23,      23,     1.0,     0.8,     2.2,     3.5,     3.5,     3.5,    1.0,  0.00000,      0,      0,       0,       0,       0,       0
total,           748,     725,     725,     725,    69.3,   100.3,   100.7,   101.1,   101.7,   101.8,    2.0,  0.66779,      0,      0,       0,       0,       0,       0
total,          1518,     770,     770,     770,    65.2,   100.3,   100.4,   100.5,   102.7,   103.4,    3.0,  0.39211,      0,      0,       0,       0,       0,       0
total,          2239,     721,     721,     721,    69.6,   100.3,   100.4,   100.5,   103.5,   103.5,    4.0,  0.27853,      0,      0,       0,       0,       0,       0
total,          2993,     754,     754,     754,    66.6,   100.3,   100.4,   100.5,   100.6,   100.6,    5.0,  0.21629,      0,      0,       0,       0,       0,       0
total,          3725,     732,     732,     732,    68.6,   100.3,   100.4,   100.5,   100.6,   100.7,    6.0,  0.17684,      0,      0,       0,       0,       0,       0
total,          4471,     746,     746,     746,    67.3,   100.3,   100.4,   100.4,   100.5,   100.5,    7.0,  0.14959,      0,      0,       0,       0,       0,       0
total,          5219,     748,     748,     748,    67.1,   100.3,   100.4,   100.5,   100.7,   102.8,    8.0,  0.12964,      0,      0,       0,       0,       0,       0
total,          5985,     766,     766,     766,    65.5,   100.3,   100.4,   100.5,   102.4,   102.4,    9.0,  0.11446,      0,      0,       0,       0,       0,       0
total,          6731,     746,     746,     746,    67.3,   100.3,   100.4,   100.5,   100.7,   102.2,   10.0,  0.10242,      0,      0,       0,       0,       0,       0
total,          7487,     756,     756,     756,    66.4,   100.3,   100.4,   100.5,   100.5,   100.5,   11.0,  0.09268,      0,      0,       0,       0,       0,       0
total,          8246,     759,     759,     759,    66.1,   100.3,   100.3,   100.4,   100.5,   100.5,   12.0,  0.08463,      0,      0,       0,       0,       0,       0
total,          8995,     749,     749,     749,    67.0,   100.3,   100.4,   100.5,   100.6,   100.9,   13.0,  0.07787,      0,      0,       0,       0,       0,       0
total,          9757,     762,     762,     762,    65.9,   100.3,   100.4,   100.5,   100.5,   100.5,   14.0,  0.07212,      0,      0,       0,       0,       0,       0
total,         10489,     732,     732,     732,    68.6,   100.3,   100.4,   100.5,   100.5,   100.5,   15.0,  0.06716,      0,      0,       0,       0,       0,       0
total,         11259,     770,     770,     770,    65.2,   100.3,   100.4,   100.5,   103.5,   104.0,   16.0,  0.06287,      0,      0,       0,       0,       0,       0
total,         12003,     744,     744,     744,    67.5,   100.3,   100.3,   100.4,   100.5,   100.5,   17.0,  0.05906,      0,      0,       0,       0,       0,       0
total,         12746,     743,     743,     743,    67.6,   100.3,   100.4,   100.5,   100.5,   100.5,   18.0,  0.05569,      0,      0,       0,       0,       0,       0
total,         13507,     761,     761,     761,    66.0,   100.3,   100.4,   100.5,   100.5,   100.6,   19.0,  0.05269,      0,      0,       0,       0,       0,       0
total,         14259,     752,     752,     752,    66.8,   100.3,   100.4,   100.5,   100.5,   100.6,   20.0,  0.04999,      0,      0,       0,       0,       0,       0
total,         15009,     750,     750,     750,    66.9,   100.3,   100.4,   100.5,   100.6,   100.6,   21.0,  0.04756,      0,      0,       0,       0,       0,       0
total,         15771,     762,     762,     762,    65.8,   100.3,   100.4,   100.5,   100.6,   106.6,   22.0,  0.04536,      0,      0,       0,       0,       0,       0
total,         16463,     692,     692,     692,    69.8,   100.3,   100.4,   100.5,   100.5,   100.6,   23.0,  0.04348,      0,      0,       0,       0,       0,       0
total,         17206,     743,     743,     743,    63.5,   100.3,   100.4,   100.5,   100.6,   100.6,   24.0,  0.04163,      0,      0,       0,       0,       0,       0
total,         17969,     763,     763,     763,    65.8,   100.3,   100.4,   100.5,   106.2,   106.3,   25.0,  0.03995,      0,      0,       0,       0,       0,       0
total,         18693,     724,     724,     724,    69.3,   100.3,   100.4,   100.5,   100.5,   100.5,   26.0,  0.03840,      0,      0,       0,       0,       0,       0
total,         19438,     745,     745,     745,    67.4,   100.3,   100.4,   100.5,   100.6,   101.0,   27.0,  0.03696,      0,      0,       0,       0,       0,       0
total,         20185,     747,     747,     747,    67.2,   100.3,   100.4,   100.4,   100.5,   100.5,   28.0,  0.03561,      0,      0,       0,       0,       0,       0
total,         20896,     711,     711,     711,    70.6,   100.3,   100.4,   100.4,   100.5,   100.5,   29.0,  0.03441,      0,      0,       0,       0,       0,       0
total,         21628,     732,     732,     732,    68.6,   100.3,   100.4,   100.5,   100.5,   100.5,   30.0,  0.03325,      0,      0,       0,       0,       0,       0
total,         22341,     760,     760,     760,    70.4,   100.3,   100.5,   101.3,   101.4,   101.4,   30.9,  0.03217,      0,      0,       0,       0,       0,       0


Results:
Op rate                   :      722 op/s  [WRITE: 722 op/s]
Partition rate            :      722 pk/s  [WRITE: 722 pk/s]
Row rate                  :      722 row/s [WRITE: 722 row/s]
Latency mean              :   67.2 ms [WRITE: 67.2 ms]
Latency median            :  100.3 ms [WRITE: 100.3 ms]
Latency 95th percentile   :  100.4 ms [WRITE: 100.4 ms]
Latency 99th percentile   :  100.5 ms [WRITE: 100.5 ms]
Latency 99.9th percentile :  101.4 ms [WRITE: 101.4 ms]
Latency max               :  106.6 ms [WRITE: 106.6 ms]
Total partitions          :     22,341 [WRITE: 22,341]
Total errors              :          0 [WRITE: 0]
Total GC count            : 0
Total GC memory           : 0.000 KiB
Total GC time             :    0.0 seconds
Avg GC time               :    NaN ms
StdDev GC time            :    0.0 ms
Total operation time      : 00:00:30

END
