******************** Stress Settings ********************
Command:
  Type: write
  Count: -1
  Duration: 30 SECONDS
  No Warmup: false
  Consistency Level: ONE
  Target Uncertainty: not applicable
  Key Size (bytes): 10
  Counter Increment Distibution: add=fixed(1)
Rate:
  Auto: false
  Thread Count: 50
  OpsPer Sec: 0
Population:
  Sequence: 1..1000000
  Order: ARBITRARY
  Wrap: true
Insert:
  Revisits: Uniform:  min=1,max=1000000
  Visits: Fixed:  key=1
  Row Population Ratio: Ratio: divisor=1.000000;delegate=Fixed:  key=1
  Batch Type: not batching
Columns:
  Max Columns Per Key: 1
  Column Names: [C0]
  Comparator: AsciiType
  Timestamp: null
  Variable Column Count: false
  Slice: false
  Size Distribution: Fixed:  key=34
  Count Distribution: Fixed:  key=1
Errors:
  Ignore: false
  Tries: 10
Log:
  No Summary: false
  No Settings: false
  File: null
  Interval Millis: 1000
  Level: NORMAL
Mode:
  API: JAVA_DRIVER_NATIVE
  Connection Style: CQL_PREPARED
  CQL Version: CQL3
  Protocol Version: V4
  Username: null
  Password: null
  Auth Provide Class: null
  Max Pending Per Connection: 128
  Connections Per Host: 8
  Compression: NONE
Node:
  Nodes: [cassandra_a, cassandra_b, cassandra_c]
  Is White List: false
  Datacenter: null
Schema:
  Keyspace: keyspace1
  Replication Strategy: org.apache.cassandra.locator.SimpleStrategy
  Replication Strategy Pptions: {replication_factor=3}
  Table Compression: null
  Table Compaction Strategy: null
  Table Compaction Strategy Options: {}
Transport:
  factory=org.apache.cassandra.thrift.TFramedTransportFactory; truststore=null; truststore-password=null; keystore=null; keystore-password=null; ssl-protocol=TLS; ssl-alg=SunX509; store-type=JKS; ssl-ciphers=TLS_RSA_WITH_AES_128_CBC_SHA,TLS_RSA_WITH_AES_256_CBC_SHA; 
Port:
  Native Port: 9042
  Thrift Port: 9160
  JMX Port: 7199
Send To Daemon:
  *not set*
Graph:
  File: null
  Revision: unknown
  Title: null
  Operation: WRITE
TokenRange:
  Wrap: false
  Split Factor: 1

Connected to cluster: TestCluster, max pending requests per connection 128, max connections per host 8
Datatacenter: datacenter1; Host: cassandra_a/172.28.0.2; Rack: rack1
Datatacenter: datacenter1; Host: cassandra_b/172.28.0.3; Rack: rack1
Datatacenter: datacenter1; Host: cassandra_c/172.28.0.4; Rack: rack1
Created keyspaces. Sleeping 3s for propagation.
Sleeping 2s...
Warming up WRITE with 150000 iterations...
Failed to connect over JMX; not collecting these stats
Running WRITE with 50 threads 30 seconds
Failed to connect over JMX; not collecting these stats
type       total ops,    op/s,    pk/s,   row/s,    mean,     med,     .95,     .99,    .999,     max,   time,   stderr, errors,  gc: #,  max ms,  sum ms,  sdv ms,      mb
total,           735,     735,     735,     735,    30.9,    50.3,    50.4,    50.6,    52.0,    52.3,    1.0,  0.00000,      0,      0,       0,       0,       0,       0
total,          2265,    1530,    1530,    1530,    32.9,    50.3,    50.4,    50.4,    50.5,    50.5,    2.0,  0.24759,      0,      0,       0,       0,       0,       0
total,          3790,    1525,    1525,    1525,    33.0,    50.3,    50.4,    50.4,    50.4,    50.5,    3.0,  0.17036,      0,      0,       0,       0,       0,       0
total,          5299,    1509,    1509,    1509,    33.3,    50.3,    50.4,    50.4,    50.5,    50.5,    4.0,  0.12828,      0,      0,       0,       0,       0,       0
total,          6675,    1376,    1376,    1376,    35.3,    50.3,    50.4,    50.4,    67.8,    71.4,    5.0,  0.10196,      0,      0,       0,       0,       0,       0
total,          8186,    1511,    1511,    1511,    33.0,    50.3,    50.3,    50.4,    50.5,    50.8,    6.0,  0.08532,      0,      0,       0,       0,       0,       0
total,          9668,    1482,    1482,    1482,    34.0,    50.3,    50.4,    50.5,    54.3,    54.9,    7.0,  0.07312,      0,      0,       0,       0,       0,       0
total,         11130,    1462,    1462,    1462,    34.4,    50.3,    50.4,    50.4,    50.5,    50.5,    8.0,  0.06386,      0,      0,       0,       0,       0,       0
total,         12655,    1525,    1525,    1525,    33.0,    50.3,    50.4,    50.4,    50.5,    51.1,    9.0,  0.05701,      0,      0,       0,       0,       0,       0
total,         14134,    1479,    1479,    1479,    34.1,    50.3,    50.4,    50.4,    50.5,    50.6,   10.0,  0.05126,      0,      0,       0,       0,       0,       0
total,         15595,    1461,    1461,    1461,    33.5,    50.3,    50.4,    50.4,    50.6,    50.6,   11.0,  0.04655,      0,      0,       0,       0,       0,       0
total,         17057,    1462,    1462,    1462,    33.8,    50.3,    50.4,    50.4,    50.5,    50.6,   12.0,  0.04263,      0,      0,       0,       0,       0,       0
total,         18609,    1552,    1552,    1552,    32.5,    50.3,    50.4,    50.4,    50.5,    50.6,   13.0,  0.03963,      0,      0,       0,       0,       0,       0
total,         20074,    1465,    1465,    1465,    34.4,    50.3,    50.4,    50.4,    50.5,    50.5,   14.0,  0.03677,      0,      0,       0,       0,       0,       0
total,         21500,    1426,    1426,    1426,    35.3,    50.3,    50.4,    50.4,    50.6,    50.6,   15.0,  0.03434,      0,      0,       0,       0,       0,       0
total,         23024,    1524,    1524,    1524,    33.1,    50.3,    50.4,    50.5,    50.6,    50.6,   16.0,  0.03228,      0,      0,       0,       0,       0,       0
total,         24492,    1468,    1468,    1468,    33.5,    50.3,    50.4,    50.5,    50.7,    50.7,   17.0,  0.03037,      0,      0,       0,       0,       0,       0
total,         25979,    1487,    1487,    1487,    33.1,    50.3,    50.4,    50.5,    50.5,    50.6,   18.0,  0.02868,      0,      0,       0,       0,       0,       0
total,         27490,    1511,    1511,    1511,    33.3,    50.3,    50.4,    50.4,    50.5,    50.5,   19.0,  0.02721,      0,      0,       0,       0,       0,       0
total,         28999,    1509,    1509,    1509,    33.4,    50.3,    50.4,    50.4,    50.5,    50.7,   20.0,  0.02587,      0,      0,       0,       0,       0,       0
total,         30473,    1474,    1474,    1474,    34.2,    50.3,    50.4,    50.4,    50.6,    50.6,   21.0,  0.02463,      0,      0,       0,       0,       0,       0
total,         31997,    1524,    1524,    1524,    33.1,    50.3,    50.4,    50.4,    50.4,    50.5,   22.0,  0.02356,      0,      0,       0,       0,       0,       0
total,         33463,    1466,    1466,    1466,    33.9,    50.3,    50.4,    50.4,    55.2,    55.7,   23.0,  0.02253,      0,      0,       0,       0,       0,       0
total,         34913,    1450,    1450,    1450,    33.6,    50.3,    50.4,    50.4,    50.5,    50.5,   24.0,  0.02160,      0,      0,       0,       0,       0,       0
total,         36344,    1431,    1431,    1431,    35.2,    50.3,    50.4,    50.4,    50.5,    50.6,   25.0,  0.02076,      0,      0,       0,       0,       0,       0
total,         37823,    1479,    1479,    1479,    34.0,    50.3,    50.4,    50.4,    52.1,    52.7,   26.0,  0.01996,      0,      0,       0,       0,       0,       0
total,         39341,    1518,    1518,    1518,    33.1,    50.3,    50.3,    50.4,    50.4,    50.7,   27.0,  0.01925,      0,      0,       0,       0,       0,       0
total,         40815,    1474,    1474,    1474,    34.2,    50.3,    50.4,    50.4,    53.5,    53.9,   28.0,  0.01856,      0,      0,       0,       0,       0,       0
total,         42335,    1520,    1520,    1520,    33.1,    50.3,    50.4,    50.4,    50.4,    50.5,   29.0,  0.01795,      0,      0,       0,       0,       0,       0
total,         43810,    1475,    1475,    1475,    33.0,    50.3,    50.4,    50.4,    50.5,    50.5,   30.0,  0.01735,      0,      0,       0,       0,       0,       0
total,         44645,    1495,    1495,    1495,    34.5,    50.3,    50.4,    50.4,    51.0,    51.1,   30.6,  0.01689,      0,      0,       0,       0,       0,       0


Results:
Op rate                   :    1,461 op/s  [WRITE: 1,461 op/s]
Partition rate            :    1,461 pk/s  [WRITE: 1,461 pk/s]
Row rate                  :    1,461 row/s [WRITE: 1,461 row/s]
Latency mean              :   33.6 ms [WRITE: 33.6 ms]
Latency median            :   50.3 ms [WRITE: 50.3 ms]
Latency 95th percentile   :   50.4 ms [WRITE: 50.4 ms]
Latency 99th percentile   :   50.4 ms [WRITE: 50.4 ms]
Latency 99.9th percentile :   50.6 ms [WRITE: 50.6 ms]
Latency max               :   71.4 ms [WRITE: 71.4 ms]
Total partitions          :     44,645 [WRITE: 44,645]
Total errors              :          0 [WRITE: 0]
Total GC count            : 0
Total GC memory           : 0.000 KiB
Total GC time             :    0.0 seconds
Avg GC time               :    NaN ms
StdDev GC time            :    0.0 ms
Total operation time      : 00:00:30

END
